{
  "productID": "PROD-002",
  "title": "RailSafe Inspector Mobile App",
  "description": "Mobile application for field inspectors to conduct track inspections, capture data, and generate reports in real-time",
  "purpose": "Digitize field inspection processes and improve data quality and timeliness",
  "owner": "Mobile Development Team",
  "productCategory": "digitalProduct",
  "productType": "software",
  "targetMarket": "internal",
  "businessModel": "internalTool",
  "lifecycleStage": "growth",
  "customerSegments": [
    "internal"
  ],
  "channels": [
    "mobileApp",
    "internalDistribution"
  ],
  "valueProposition": "Reduce inspection time by 40% and improve data accuracy by 60%",
  "technologyStack": "React Native, Node.js, PostgreSQL, AWS",
  "riskCategories": [
    "technology",
    "security",
    "operational"
  ]
}
