{
  "productID": "PROD-004",
  "title": "SmartTrack Geometry Sensor",
  "description": "Advanced IoT sensor for continuous track geometry monitoring with realtime data transmission",
  "purpose": "Enable continuous track monitoring and predictive maintenance capabilities",
  "owner": "Hardware Engineering Team",
  "productCategory": "physicalProduct",
  "productType": "hardware",
  "targetMarket": "b2b",
  "businessModel": "oneTimePurchase",
  "lifecycleStage": "development",
  "customerSegments": [
    "enterprise",
    "government"
  ],
  "channels": [
    "directSales",
    "partnerChannel"
  ],
  "pricingStrategy": "valueBased",
  "valueProposition": "24/7 monitoring reduces unplanned maintenance by 50%",
  "riskCategories": [
    "technology",
    "market",
    "quality"
  ]
}
