{
  "productID": "PROD-003",
  "title": "Rail Data Integration Platform",
  "description": "RESTful API platform providing secure access to rail infrastructure data for internal and partner systems",
  "purpose": "Enable data integration and sharing across rail ecosystem partners",
  "owner": "Platform Engineering Team",
  "productCategory": "platformProduct",
  "productType": "api",
  "targetMarket": "b2b",
  "businessModel": "usageBased",
  "lifecycleStage": "launch",
  "customerSegments": [
    "enterprise",
    "partner",
    "developer"
  ],
  "channels": [
    "api",
    "developerPortal"
  ],
  "pricingStrategy": "usageBased",
  "complianceRequirements": [
    "gdpr",
    "industryStandards"
  ],
  "valueProposition": "Reduce integration time by 75% with standardized data access",
  "riskCategories": [
    "technology",
    "security",
    "compliance"
  ]
}
